id,name,version,layout,released_at,cost,inkwell,ink,text,move_cost,strength,willpower,lore,rarity,collector_number,lang,flavor_text,tcgplayer_id
crd_1d41bcb819ef4f12b40b5aab332e0c4c,Maximus,Palace Horse,normal,2023-08-18,5,True,Amber,"Bodyguard (This character may enter play exerted. An opposing character who challenges one of your characters must choose one with Bodyguard if able.)
Support (Whenever this character quests, you may add their {S} to another chosen character's {S} this turn.)",,4.0,5.0,1.0,Super_rare,10,en,,506837.0
crd_dbc44ab9437a44568efdf23b37f3f278,Maximus,Relentless Pursuer,normal,2023-08-18,3,True,Amber,"HORSE KICK When you play this character, chosen character gets -2 {S} this turn.",,3.0,3.0,1.0,Uncommon,11,en,"He pursues his quarry with courage, discipline, and a touch of class.",494101.0
crd_682afbbf65fa43ec8d17d382183a81e0,Mickey Mouse,True Friend,normal,2023-08-18,3,True,Amber,,,3.0,3.0,2.0,Uncommon,12,en,"As long as he's around, newcomers to the Great Illuminary will always get a warm welcome.",493476.0
crd_e40a35d966914476b267935d79337667,Minnie Mouse,Beloved Princess,normal,2023-08-18,2,True,Amber,,,2.0,3.0,1.0,Common,13,en,"Wherever the princess goes, her musketeers are... well, they're around somewhere, probably.",493498.0
crd_6c18714222c749b8b16800630a5d26cf,Moana,Of Motunui,normal,2023-08-18,5,True,Amber,"WE CAN FIX IT Whenever this character quests, you may ready your other Princess characters. They can't quest for the rest of this turn.",,1.0,6.0,3.0,Rare,14,en,"""I am Moana of Motunui. You will board my boat, sail across the sea, and restore the heart of Te Fiti.""",492739.0
crd_ef759d382c954423b841d6cbac94dfbc,Mr. Smee,Loyal First Mate,normal,2023-08-18,3,True,Amber,,,2.0,5.0,1.0,Common,15,en,"""Mr. Smee is a kind, gentle soul who lives to bring comfort and aid to a twisted old villain. Now, what good is kindness like that?""
—Peter Pan",508697.0
crd_f1e67c29942c408daaa683520972e1ea,Prince Phillip,Dragonslayer,normal,2023-08-18,4,False,Amber,"HEROISM When this character challenges and is banished, you may banish the challenged character.",,3.0,3.0,2.0,Uncommon,16,en,"""The road to true love may be barred by still many more dangers, which you alone will have to face.""
—Flora",505946.0
crd_389a5296a2114c10a16be57f0677429f,Pumbaa,Friendly Warthog,normal,2023-08-18,4,True,Amber,,,3.0,5.0,1.0,Common,17,en,"""You gotta put your behind in your past.""",508701.0
crd_63a9a93217614c00a186fe10b8791073,Rapunzel,Gifted with Healing,normal,2023-08-18,4,True,Amber,"GLEAM AND GLOW When you play this character, remove up to 3 damage from one of your characters. Draw a card for each 1 damage removed this way.",,1.0,5.0,2.0,Legendary,18,en,,506836.0
crd_acaae5dbf3c341b8ad35851ac755cfd6,Sebastian,Court Composer,normal,2023-08-18,2,True,Amber,Singer 4 (This character counts as cost 4 to sing songs.),,2.0,2.0,1.0,Common,19,en,"""I should be writing symphonies, not tagging along after some headstrong teenager.""",504540.0
crd_a3bd1e1b8b3a4ca094cefbc1d7bf4d60,Simba,Protective Cub,normal,2023-08-18,2,True,Amber,Bodyguard (This character may enter play exerted. An opposing character who challenges one of your characters must choose one with Bodyguard if able.),,2.0,3.0,1.0,Common,20,en,Courage comes in all sizes.,503356.0
crd_78e5de38150f48c5b9813c08cc534dfb,Stitch,Carefree Surfer,normal,2023-08-18,7,True,Amber,"OHANA When you play this character, if you have 2 or more other characters in play, you may draw 2 cards.",,4.0,8.0,2.0,Legendary,21,en,"""So you're from outer space, huh? I hear the surfing's choice.""
—David",502009.0
crd_a46be9bd3971477695ee84d0f25ff88d,Stitch,New Dog,normal,2023-08-18,1,True,Amber,,,2.0,2.0,1.0,Common,22,en,"Lilo: ""David! I got a new dog!""
David: ""Auwe!...You sure it's a dog?""
Lilo: ""Uh-huh. He used to be a collie before he got ran over.""",493499.0
crd_c32945ecfd3d44859d3af3841977a737,Stitch,Rock Star,normal,2023-08-18,6,True,Amber,"Shift 4 (You may pay 4 {I} to play this on top of one of your characters named Stitch.)
ADORING FANS Whenever you play a character with cost 2 or less, you may exert them to draw a card.",,3.0,5.0,3.0,Super_rare,23,en,The best part about a beachside concert is that there's always room for one more.,492708.0
crd_a7a780b01376481388b871a1b533de08,Timon,Grub Rustler,normal,2023-08-18,1,True,Amber,"TASTES LIKE CHICKEN When you play this character, you may remove up to 1 damage from chosen character.",,1.0,2.0,1.0,Common,24,en,"""There's all manner of tasty treats in the world—ya just gotta know where to look.""",497197.0
crd_49437643a6454368a630d12ba20c146f,Be Our Guest,,normal,2023-08-18,2,True,Amber,"(A character with cost 2 or more can {E} to sing this song for free.)
Look at the top 4 cards of your deck. You may reveal a character card and put it into your hand. Put the rest on the bottom of your deck in any order.",,,,,Uncommon,25,en,,494110.0
crd_3a593c8dd2fe4552a4874f7346527387,Control Your Temper!,,normal,2023-08-18,1,True,Amber,Chosen character gets -2 {S} this turn.,,,,,Common,26,en,,493501.0
crd_2894c74113e7436abf095fe35dde6ea8,Hakuna Matata,,normal,2023-08-18,4,True,Amber,"(A character with cost 4 or more can {E} to sing this song for free.)
Remove up to 3 damage from each of your characters.",,,,,Common,27,en,What a wonderful phrase!,506124.0
crd_ce4f357a6aa24302ba5553eefea4930a,Healing Glow,,normal,2023-08-18,1,True,Amber,Remove up to 2 damage from chosen character.,,,,,Common,28,en,"""Don't freak out!""
—Rapunzel",492713.0
crd_4d9c8fd7ab2241d9893ca3ad6a31daed,Just in Time,,normal,2023-08-18,3,False,Amber,You may play a character with cost 5 or less for free.,,,,,Rare,29,en,The best heroes always arrive at the perfect moment—whether they know it or not.,492737.0
crd_df53bbf046f542d19202f4e11bbe9d5b,Part of Your World,,normal,2023-08-18,3,False,Amber,"(A character with cost 3 or more can {E} to sing this song for free.)
Return a character card from your discard to your hand.",,,,,Rare,30,en,"What would I give
If I could live out of these waters?",493481.0
crd_c91b8810b881450faa5942daf03e03ef,You Have Forgotten Me,,normal,2023-08-18,4,True,Amber,Each opponent chooses and discards 2 cards.,,,,,Uncommon,31,en,"""You are more than what you have become.""
—Mufasa",508716.0
crd_4ab0c55e07324d30903f51b7bbd41c8d,Dinglehopper,,normal,2023-08-18,1,True,Amber,STRAIGHTEN HAIR {E} — Remove up to 1 damage from chosen character.,,,,,Common,32,en,Enjoy the finest of human hairstyles!,492733.0
crd_8d54bb18a7514ab19536ac9afe747002,Lantern,,normal,2023-08-18,2,False,Amber,BIRTHDAY LIGHTS {E} — You pay 1 {I} less for the next character you play this turn.,,,,,Rare,33,en,"Lanterns fill the sky on one special night, beacons of hope and love.",493500.0
crd_a2c18604455b4a4c8d4868ad36370d3d,Ursula's Shell Necklace,,normal,2023-08-18,3,False,Amber,"NOW, SING! Whenever you play a song, you may pay 1 {I} to draw a card.",,,,,Rare,34,en,"""Singing is a lovely pastime...if you've got the voice for it.""
—Ursula",504692.0
crd_6e2cd50802964cfdb903d16ef856caae,Anna,Heir to Arendelle,normal,2023-08-18,4,True,Amethyst,"LOVING HEART When you play this character, if you have a character named Elsa in play, choose an opposing character. The chosen character doesn't ready at the start of their next turn.",,2.0,4.0,2.0,Uncommon,35,en,"""Two sisters, one mind.""",504444.0
crd_f2b9a7e014e64eca88d8c9c7eee07019,Archimedes,Highly Educated Owl,normal,2023-08-18,1,True,Amethyst,,,2.0,2.0,1.0,Common,36,en,"""Flying is not merely some crude, mechanical process. It is a delicate art. Purely aesthetic. Poetry of motion. And the best way to learn it is to do it!""",501406.0
crd_a23c8618b0aa41f9b41b9f0603495380,Dr. Facilier,Agent Provocateur,normal,2023-08-18,7,False,Amethyst,"Shift 5 (You may pay 5 {I} to play this on top of one of your characters named Dr. Facilier.)
INTO THE SHADOWS Whenever one of your other characters is banished in a challenge, you may return that card to your hand.",,4.0,5.0,3.0,Rare,37,en,,508723.0
crd_17c7228380dd4d8e8b5e2cce3058d9d3,Dr. Facilier,Charlatan,normal,2023-08-18,2,True,Amethyst,"Challenger +2 (While challenging, this character gets +2 {S}.)",,0.0,4.0,1.0,Common,38,en,"""Enchantée. A tip of the hat from Dr. Facilier.""",494099.0
crd_7c6dbcfcfb90484c9e7d5f28cee46687,Dr. Facilier,Remarkable Gentleman,normal,2023-08-18,3,True,Amethyst,"DREAMS MADE REAL Whenever you play a song, you may look at the top 2 cards of your deck. Put one on the top of your deck and the other on the bottom.",,2.0,4.0,1.0,Rare,39,en,,508727.0
crd_643a385f109c4e50a6462b86c64b98b2,Elsa,Queen Regent,normal,2023-08-18,4,True,Amethyst,,,4.0,4.0,1.0,Common,40,en,"""I never knew what I was capable of.""",507276.0
crd_cd96e3f148dd46de80ac08abe51a48e4,Elsa,Snow Queen,normal,2023-08-18,3,True,Amethyst,FREEZE {E} — Exert chosen opposing character.,,2.0,3.0,1.0,Uncommon,41,en,"Recreated by magical ink, Elsa found herself in an entirely new world. Fortunately, ice works the same way everywhere.",492705.0
crd_04bca46a8e2d4e9ba0fbdbfc6c99e51e,Elsa,Spirit of Winter,normal,2023-08-18,8,False,Amethyst,"Shift 6 (You may pay 6 {I} to play this on top of one of your characters named Elsa.)
DEEP FREEZE When you play this character, exert up to 2 chosen characters. They can't ready at the start of their next turn.",,4.0,6.0,3.0,Legendary,42,en,Ice is stronger than you may think.,507512.0
crd_e5912655e48f42a9ab863ac2337171cc,Flotsam,Ursula's Spy,normal,2023-08-18,5,False,Amethyst,"Rush (This character can challenge the turn they're played.)
DEXTEROUS LUNGE Your characters named Jetsam gain Rush.",,3.0,4.0,2.0,Rare,43,en,"""We know someone who can help you... for a price.""",503318.0
crd_10bcf02ebeea4a3c8aac36e976120e99,Jafar,Keeper of Secrets,normal,2023-08-18,4,True,Amethyst,HIDDEN WONDERS This character gets +1 {S} for each card in your hand.,,0.0,5.0,2.0,Rare,44,en,There's more than one way to bury secrets.,507719.0
crd_695cab1b70c24a0289cc2d3c2316dfed,Jafar,Wicked Sorcerer,normal,2023-08-18,4,True,Amethyst,"Challenger +3 (While challenging, this character gets +3 {S}.)",,2.0,5.0,1.0,Common,45,en,"""Enough skulking about. It's time to show that sniveling sultan what a sorcerer can do.""",494098.0
crd_3725a62bd3aa40a086ad041a84a910d3,Jetsam,Ursula's Spy,normal,2023-08-18,4,True,Amethyst,"Evasive (Only characters with Evasive can challenge this character.)
SINISTER SLITHER Your characters named Flotsam gain Evasive.",,3.0,3.0,1.0,Common,46,en,"""We can help you get anything you want....""",503317.0
crd_95ecf1d59f004e4399a2c61e280dfd13,Magic Broom,Bucket Brigade,normal,2023-08-18,2,True,Amethyst,"SWEEP When you play this character, you may shuffle a card from any discard into its player's deck.",,2.0,2.0,1.0,Common,47,en,"In the immense story-forge known as the Great Illuminary, there is always work to be done.",493477.0
crd_ed5b22e519844e948a57784cdc4d5a48,Maleficent,Biding Her Time,normal,2023-08-18,1,False,Amethyst,,,1.0,1.0,2.0,Rare,48,en,"""One mustn't rush these things, or the greatest plan might come to nothing.""",493485.0
crd_ff8bf99d2bd84183bcc4b5d7a18360f0,Maleficent,Sorceress,normal,2023-08-18,3,True,Amethyst,"CAST MY SPELL! When you play this character, you may draw a card.",,2.0,2.0,1.0,Common,49,en,"""You dare challenge me? Fool, my magic is more powerful than you could possibly imagine!""",494103.0
crd_de3c296136f24c1a8bada1580861504c,Marshmallow,Persistent Guardian,normal,2023-08-18,6,False,Amethyst,"DURABLE When this character is banished in a challenge, you may return this card to your hand.",,5.0,5.0,1.0,Super_rare,50,en,"""Hey! We were just talking about you! All good things, all good things.""
—Olaf",505955.0
crd_fa380ef9482e4e808e11365588c7178e,Mickey Mouse,Wayward Sorcerer,normal,2023-08-18,4,True,Amethyst,"ANIMATE BROOM You pay 1 {I} less to play Broom characters.
CEASELESS WORKER Whenever one of your Broom characters is banished in a challenge, you may return that card to your hand.",,3.0,4.0,2.0,Super_rare,51,en,He always goes for the clean sweep.,492369.0
crd_2ceed4bdc2b3437c82a41d83d9fe8aee,Olaf,Friendly Snowman,normal,2023-08-18,1,True,Amethyst,,,1.0,3.0,1.0,Uncommon,52,en,"""I'm Olaf and I like warm hugs!""",485381.0
crd_52d47bf453634824858ebdd26f42d5f6,Pascal,Rapunzel's Companion,normal,2023-08-18,1,True,Amethyst,"CAMOUFLAGE While you have another character in play, this character gains Evasive. (Only characters with Evasive can challenge them.)",,1.0,1.0,1.0,Uncommon,53,en,"A true friend is always there for you, whether you can see them or not.",493488.0
crd_3939d10a183b4eb48b843a68c74ed87b,Rafiki,Mysterious Sage,normal,2023-08-18,3,False,Amethyst,Rush (This character can challenge the turn they're played.),,3.0,3.0,1.0,Uncommon,54,en,"""The past can hurt. But the way I see it, you can either run from it or learn from it.""",501405.0
crd_33319f66def14264811a95e658040bb9,Sven,Official Ice Deliverer,normal,2023-08-18,6,True,Amethyst,,,5.0,7.0,1.0,Uncommon,55,en,"""Reindeer comin' through!""
—Kristoff",502010.0
crd_03be711c05fe4b8ebd081c3578f37444,The Queen,Wicked and Vain,normal,2023-08-18,5,True,Amethyst,I SUMMON THEE {E} — Draw a card.,,4.0,5.0,1.0,Super_rare,56,en,Sublime beauty matched with peerless cunning. Is there any question who is fairest?,508751.0
crd_0ab2ecd7d121461e8053278706d889d5,The Wardrobe,Belle's Confidant,normal,2023-08-18,3,True,Amethyst,,,3.0,4.0,1.0,Common,57,en,When you simply must have the hautest couture.,485363.0
crd_3ac122b5a08e42ac986aa536da6c1000,Tinker Bell,Peter Pan's Ally,normal,2023-08-18,5,False,Amethyst,"Evasive (Only characters with Evasive can challenge this character.)
LOYAL AND DEVOTED Your characters named Peter Pan gain Challenger +1. (They get +1 {S} while challenging.)",,3.0,3.0,2.0,Common,58,en,,507488.0
crd_2700ee961f214ad48e6284b2a8e864dc,Ursula,Power Hungry,normal,2023-08-18,7,False,Amethyst,"IT'S TOO EASY! When you play this character, each opponent loses 1 lore. You may draw a card for each 1 lore lost this way.",,2.0,8.0,3.0,Legendary,59,en,"The first Rule of Villainy: If you're going to be evil, you've got to have style.",508755.0
crd_fd1e38170964420294911187ef450c55,Yzma,Alchemist,normal,2023-08-18,2,True,Amethyst,"YOU'RE EXCUSED Whenever this character quests, look at the top card of your deck. Put it on either the top or the bottom of your deck.",,2.0,2.0,1.0,Common,60,en,"""When I want your opinion, I will give it to you!""",492715.0
crd_48d5eae218d14c72a3b0485e369b2d06,Zeus,God of Lightning,normal,2023-08-18,4,False,Amethyst,"Rush (This character can challenge the turn they're played.)
Challenger +4 (While challenging, this character gets +4 {S}.)",,0.0,4.0,2.0,Rare,61,en,"""A little lightning solves a whole lot of problems.""",502540.0
crd_6e2faccbf9a240219279b1c4acff7bd5,Befuddle,,normal,2023-08-18,1,True,Amethyst,Return a character or item with cost 2 or less to their player's hand.,,,,,Uncommon,62,en,Never be afraid to have your mind boggled now and then.,503355.0
crd_7ea36567dec64789a714995b1f459a47,Freeze,,normal,2023-08-18,2,False,Amethyst,Exert chosen opposing character.,,,,,Common,63,en,It's time for you to chill.,508733.0
crd_f9097c53f99d488aa8685b73ea5a9373,Friends on the Other Side,,normal,2023-08-18,3,True,Amethyst,"(A character with cost 3 or more can {E} to sing this song for free.)
Draw 2 cards.",,,,,Common,64,en,"The cards, the cards
the cards will tell...",494100.0
crd_2edd696f67314cde96ae6ff8f6661033,Reflection,,normal,2023-08-18,1,True,Amethyst,"(A character with cost 1 or more can {E} to sing this song for free.)
Look at the top 3 cards of your deck. Put them back on the top of your deck in any order.",,,,,Uncommon,65,en,"When will my reflection show
Who I am inside?",506113.0
crd_75b7a6e439114050b3e283955b439058,Magic Mirror,,normal,2023-08-18,2,False,Amethyst,"SPEAK! {E}, 4 {I} — Draw a card.",,,,,Rare,66,en,"""What wouldst thou know, my Queen?""",492714.0
crd_9548bea5e69544d5b3e488e97d33065c,Ursula's Cauldron,,normal,2023-08-18,2,False,Amethyst,PEER INTO THE DEPTHS {E} — Look at the top 2 cards of your deck. Put one on the top of your deck and the other on the bottom.,,,,,Uncommon,67,en,Perfect for mixing potions and stealing voices.,507851.0
crd_5e059b9ed96e4fb68bb54b1086394797,White Rabbit's Pocket Watch,,normal,2023-08-18,3,True,Amethyst,"I'M LATE! {E}, 1 {I} — Chosen character gains Rush this turn. (They can challenge the turn they're played.)",,,,,Rare,68,en,"""No wonder you're late. Why, this watch is exactly two days slow."" —The Mad Hatter",492712.0
crd_cae2a3157f7a42d782a2c3cefae01615,Aladdin,Prince Ali,normal,2023-08-18,2,True,Emerald,Ward (Opponents can't choose this character except to challenge.),,2.0,2.0,1.0,Common,69,en,Fabulously wealthy. Practically untouchable. Genuinely inauthentic.,485361.0
crd_cd3d8417b8544063ae6a41766d24b130,Beast,Wolfsbane,normal,2023-08-18,5,False,Emerald,"Rush (This character can challenge the turn they're played.)
ROAR When you play this character, exert all opposing damaged characters.",,4.0,4.0,2.0,Legendary,70,en,"""I'll take on all of you if I have to!""",501404.0
crd_e49c0deba37f453f8f27da810c8bfe39,Cheshire Cat,Not All There,normal,2023-08-18,3,True,Emerald,"LOSE SOMETHING? When this character is challenged and banished, banish the challenging character.",,0.0,3.0,2.0,Uncommon,71,en,"""You may have noticed that I'm not all there myself.""",492122.0
crd_a3a886b05f4149c695ffbd5e5b9a049f,Cruella De Vil,Miserable as Usual,normal,2023-08-18,2,True,Emerald,"YOU'LL BE SORRY! When this character is challenged and banished, you may return chosen character to their player's hand.",,1.0,3.0,1.0,Rare,72,en,"When she stops by, misery is company.",492703.0
crd_fb2dc6f12f584032a54f9925f060e059,Duke of Weselton,Opportunistic Official,normal,2023-08-18,1,True,Emerald,,,2.0,2.0,1.0,Common,73,en,"""Sorcery! I knew there was something dubious going on here.""",505971.0
crd_c0742f7731e04b749870bceb5c6b133b,Flynn Rider,Charming Rogue,normal,2023-08-18,2,True,Emerald,"HERE COMES THE SMOLDER Whenever this character is challenged, the challenging player chooses and discards a card.",,1.0,2.0,2.0,Uncommon,74,en,"""I didn't want to have to do this, but you leave me no choice....""",506833.0
crd_e910a64a2c12444e9eb34bab151b0428,Genie,On the Job,normal,2023-08-18,6,False,Emerald,"Evasive (Only characters with Evasive can challenge this character.)
DISAPPEAR When you play this character, you may return chosen character to their player's hand.",,3.0,4.0,2.0,Super_rare,75,en,"""Can your friends go 'Abracadabra, let 'er rip' and then make the sucker disappear?""",501228.0
crd_976b70e13c194a6f8b955d7ea5307bbc,Genie,Powers Unleashed,normal,2023-08-18,8,False,Emerald,"Shift 6 (You may pay 6 {I} to play this on top of one of your characters named Genie.)
Evasive (Only characters with Evasive can challenge this character.)
PHENOMENAL COSMIC POWER! Whenever this character quests, you may play an action with cost 5 or less for free.",,3.0,5.0,3.0,Rare,76,en,,508766.0
crd_64d94b7ad8e84bac909438767e1e63af,Genie,The Ever Impressive,normal,2023-08-18,2,True,Emerald,,,2.0,3.0,1.0,Common,77,en,"""You can wish for nearly anything! Do you want the short version, or should I give you the whole song and dance?""",507515.0
crd_c0ca53eaf2d849e7b533d0628ea7585c,Hans,Scheming Prince,normal,2023-08-18,4,True,Emerald,,,3.0,3.0,3.0,Rare,78,en,"""Rules are like older siblings. All they do is get in the way.""",505954.0
crd_449f6f94972b4bce9a87460460204cd8,Horace,No-Good Scoundrel,normal,2023-08-18,3,True,Emerald,,,4.0,3.0,1.0,Common,79,en,"""Well, they ain't in here, Jasper.""",507494.0
crd_fb67b53a2df44bff96ca7fff2d607437,Iago,Loud-Mouthed Parrot,normal,2023-08-18,3,True,Emerald,YOU GOT A PROBLEM? {E} — Chosen character gains Reckless during their next turn. (They can't quest and must challenge if able.),,1.0,4.0,1.0,Rare,80,en,,497207.0
crd_1dd05220d5994e3181153d33340718fc,Jasper,Common Crook,normal,2023-08-18,3,True,Emerald,"PUPPYNAPPING Whenever this character quests, chosen opposing character can't quest during their next turn.",,2.0,4.0,1.0,Uncommon,81,en,"""Now, look here, Horace, I warned you about thinkin'.""",507498.0
crd_ab006041fefc4aba8f3142821fded198,John Silver,Alien Pirate,normal,2023-08-18,6,True,Emerald,"PICK YOUR FIGHTS When you play this character and whenever he quests, chosen opposing character gains Reckless during their next turn. (They can't quest and must challenge if able.)",,5.0,5.0,2.0,Legendary,82,en,"""Don't be too put off by this... hunk of hardware.""",507476.0
crd_a1887fe9f3f74f7183a0a9bc44f57582,Jumba Jookiba,Renegade Scientist,normal,2023-08-18,5,True,Emerald,,,4.0,5.0,2.0,Uncommon,83,en,"""Created something? Ha! But that would be irresponsible and unethical. I would never, ever... make more than one.""",485366.0
crd_6e0fa538c4894981b9e014b0ef5efd97,Kuzco,Temperamental Emperor,normal,2023-08-18,5,False,Emerald,"Ward (Opponents can't choose this character except to challenge.)
NO TOUCHY! When this character is challenged and banished, you may banish the challenging character.",,2.0,4.0,3.0,Rare,84,en,"""I asked for emerald and that is clearly jade! What is wrong with you people?""",507284.0
crd_1acda7d08eb443e9bd36798a1fd7741a,Lady Tremaine,Wicked Stepmother,normal,2023-08-18,6,False,Emerald,"DO IT AGAIN! When you play this character, you may return an action card from your discard to your hand.",,1.0,5.0,1.0,Rare,85,en,"""If your chores are done, then clearly you don't have enough of them.""",489665.0
crd_6f4d7a28b34b4520a7456a89f3d72a15,Mad Hatter,Gracious Host,normal,2023-08-18,5,True,Emerald,"TEA PARTY Whenever this character is challenged, you may draw a card.",,2.0,4.0,3.0,Uncommon,86,en,"Mad Hatter: ""Would you like a little more tea?""
Alice: ""I haven't had any yet, so I can't very well take more.""",508770.0
crd_769e68c4d309489fa1a27c2d237a7b2e,Megara,Pulling the Strings,normal,2023-08-18,2,True,Emerald,"WONDER BOY When you play this character, chosen character gets +2 {S} this turn.",,2.0,1.0,1.0,Common,87,en,"""A deal's a deal. But falling in love was never supposed to be part of it.""",507124.0
crd_1fc96a36c5a94f05a295d7d565ece2b8,Mickey Mouse,Artful Rogue,normal,2023-08-18,7,False,Emerald,"Shift 5 (You may pay 5 {I} to play this on top of one of your characters named Mickey Mouse.)
MISDIRECTION Whenever you play an action, chosen opposing character can't quest during their next turn.",,6.0,5.0,2.0,Super_rare,88,en,"Quiet as a... well, you know.",506827.0
crd_03cc8c548715482fb5d2d3d894767dbd,Mickey Mouse,Steamboat Pilot,normal,2023-08-18,3,True,Emerald,,,3.0,4.0,1.0,Common,89,en,"On rivers throughout the Inklands, the little steamboat's whistle answers the cheery tunes of its pilot.",492709.0
crd_b9b75a9f9ec8475b836925a711e88d8d,Mother Gothel,Selfish Manipulator,normal,2023-08-18,6,True,Emerald,"SKIP THE DRAMA, STAY WITH MAMA While this character is exerted, opposing characters can't quest.",,3.0,6.0,2.0,Super_rare,90,en,"""Great. Now I'm the bad guy.""",508772.0
crd_91d042c887b54b7098c9044a36816008,Peter Pan,Never Landing,normal,2023-08-18,3,True,Emerald,Evasive (Only characters with Evasive can challenge this character.),,3.0,2.0,1.0,Common,91,en,"""What's the matter, Hook? Can't you fly?""",502535.0
crd_ce61d71725be41b7a5a766b690f56a1b,Tamatoa,Drab Little Crab,normal,2023-08-18,2,True,Emerald,,,1.0,4.0,1.0,Uncommon,92,en,"""Someday, I'll grow up to be the most crabulous crustacean the world has ever seen!""",508774.0
crd_314a692823404f41b6c94ef90a3fc5e8,Tinker Bell,Most Helpful,normal,2023-08-18,4,True,Emerald,"Evasive (Only characters with Evasive can challenge this character.)
PIXIE DUST When you play this character, chosen character gains Evasive this turn.",,2.0,3.0,2.0,Common,93,en,,508775.0
crd_c6e59761b01b488b9a46b1dbfb30707e,Do It Again!,,normal,2023-08-18,3,False,Emerald,Return an action card from your discard to your hand.,,,,,Rare,94,en,"""...Then scrub the terrace, sweep the halls and the stairs, clean the chimneys. And of course there's the mending, and the sewing, and the laundry...""
—Lady Tremaine",506830.0
crd_ae6da5a02eb8403e9dd4df5ff4dac55b,Mother Knows Best,,normal,2023-08-18,3,False,Emerald,"(A character with cost 3 or more can {E} to sing this song for free.)
Return chosen character to their player's hand.",,,,,Uncommon,95,en,"One way or another
Something will go wrong, I swear",506100.0
crd_c2b11d41ddb1477a8f7293afb674c765,Stampede,,normal,2023-08-18,1,False,Emerald,Deal 2 damage to chosen damaged character.,,,,,Common,96,en,A wildebeest stampede is like a raging river: best experienced from a distance.,505953.0
crd_cc2d13ea26124968b44151ab66a7a343,Steal from the Rich,,normal,2023-08-18,5,False,Emerald,"Whenever one of your characters quests this turn, each opponent loses 1 lore.",,,,,Rare,97,en,"""Wonder how much ol' Prince John spent on all those fancy locks.""
—Little John",508773.0
crd_cf7aaffeb44d43fdb372b21fec59ff3b,Sudden Chill,,normal,2023-08-18,2,True,Emerald,"(A character with cost 2 or more can {E} to sing this song for free.)
Each opponent chooses and discards a card.",,,,,Common,98,en,"Cruella De Vil, Cruella De Vil
If she doesn't scare you, no evil thing will",508346.0
crd_7c0b98be9394466198db3610a9b64953,The Beast is Mine!,,normal,2023-08-18,3,True,Emerald,Chosen character gains Reckless during their next turn. (They can't quest and must challenge if able.),,,,,Uncommon,99,en,"""It's only fitting that the finest hunter gets the foulest beast!""
—Gaston",494154.0
crd_85e0edbb8cbd458fa3957029a8bb5697,Vicious Betrayal,,normal,2023-08-18,1,True,Emerald,"Chosen character gets +2 {S} this turn. If a Villain character is chosen, they get +3 {S} instead.",,,,,Common,100,en,"""A true king takes matters into his own claws.""
—Scar",506150.0
